{
  "$schema": "https://json-schema.org/draft/2020-12/schema",
  "$id": "https://github.com/jusso-dev/foiled/schemas/technique-link.schema.json",
  "title": "Foiled attempt to ATT&CK technique link",
  "description": "One attempt (#25) to ATT&CK technique link produced by the rules in rules/attack/ (#26). Scored by the confidence layer (#27), shown as a technique chip (#14) and exported as a STIX attack-pattern relationship (#13). Mirrored by foiled_core::attack::AttemptTechniqueLink. See docs/attack-mapping.md.",
  "type": "object",
  "additionalProperties": false,
  "required": ["attempt_id", "attack_version", "technique_id", "matched_signals", "max_weight"],
  "properties": {
    "attempt_id": { "type": "string", "minLength": 1 },
    "attack_version": {
      "description": "The pinned ATT&CK version the ids come from (data/attack/VERSION).",
      "type": "string",
      "pattern": "^[0-9]+\\.[0-9]+$"
    },
    "technique_id": {
      "description": "Official ATT&CK technique id, never a sub-technique.",
      "type": "string",
      "pattern": "^T[0-9]{4}$"
    },
    "subtechnique_id": {
      "description": "Official sub-technique id when the rule named one. Its prefix equals technique_id.",
      "type": "string",
      "pattern": "^T[0-9]{4}\\.[0-9]{3}$"
    },
    "matched_signals": {
      "type": "array",
      "minItems": 1,
      "items": {
        "type": "object",
        "additionalProperties": false,
        "required": ["rule_id", "event_id", "weight", "summary"],
        "properties": {
          "rule_id": { "type": "string", "pattern": "^[a-z0-9][a-z0-9.-]*$" },
          "event_id": { "type": "string", "minLength": 1 },
          "weight": { "type": "integer", "minimum": 0, "maximum": 100 },
          "summary": { "type": "string", "minLength": 1 }
        }
      }
    },
    "max_weight": { "type": "integer", "minimum": 0, "maximum": 100 },
    "confidence_ref": {
      "description": "Id of the confidence record (#27) once the link has been scored.",
      "type": "string",
      "minLength": 1
    }
  }
}
